{
  "$schema": "./parity-map.schema.json",
  "version": 1,
  "components": [
    {
      "name": "InterpretationSession",
      "swift": { "symbol": "InterpretationSession", "path": "RealtimeTranslator/Realtime/InterpretationSession.swift" },
      "csharp": { "symbol": "InterpretationSession", "path": "windows/src/RealtimeTranslator.Core/Realtime/InterpretationSession.cs" },
      "fixtures": ["v1/receive-queue"]
    },
    {
      "name": "RealtimeSubtitleAssembler",
      "swift": [
        { "symbol": "RealtimeSubtitleAssembler", "path": "RealtimeTranslator/Realtime/RealtimeSubtitleAssembler.swift" },
        { "symbol": "RealtimeSubtitleUpdate", "path": "RealtimeTranslator/Realtime/RealtimeSubtitleAssembler.swift" },
        { "symbol": "LanguageSwitchSplit", "path": "RealtimeTranslator/Realtime/RealtimeSubtitleAssembler.swift" }
      ],
      "csharp": [
        { "symbol": "RealtimeSubtitleAssembler", "path": "windows/src/RealtimeTranslator.Core/Realtime/RealtimeSubtitleAssembler.cs" },
        { "symbol": "RealtimeSubtitleUpdate", "path": "windows/src/RealtimeTranslator.Core/Realtime/RealtimeSubtitleAssembler.cs" },
        { "symbol": "LanguageSwitchSplit", "path": "windows/src/RealtimeTranslator.Core/Realtime/RealtimeSubtitleAssembler.cs" }
      ],
      "fixtures": ["v2/subtitle"]
    },
    {
      "name": "RealtimeSubtitleProcessor",
      "swift": [
        { "symbol": "RealtimeSubtitleProcessor", "path": "RealtimeTranslator/Realtime/RealtimeSubtitleProcessor.swift" },
        { "symbol": "RealtimeSubtitleRoutingAction", "path": "RealtimeTranslator/Realtime/RealtimeSubtitleProcessor.swift" },
        { "symbol": "RealtimeSubtitleProcessingResult", "path": "RealtimeTranslator/Realtime/RealtimeSubtitleProcessor.swift" }
      ],
      "csharp": [
        { "symbol": "RealtimeSubtitleProcessor", "path": "windows/src/RealtimeTranslator.Core/Realtime/RealtimeSubtitleProcessor.cs" },
        { "symbol": "RealtimeSubtitleRoutingAction", "path": "windows/src/RealtimeTranslator.Core/Realtime/RealtimeSubtitleProcessor.cs" },
        { "symbol": "RealtimeSubtitleProcessingResult", "path": "windows/src/RealtimeTranslator.Core/Realtime/RealtimeSubtitleProcessor.cs" }
      ],
      "fixtures": ["v1/routing", "v2/subtitle"]
    },
    {
      "name": "ReconnectBudget",
      "swift": [
        { "symbol": "ReconnectBudget", "path": "RealtimeTranslator/Realtime/ReconnectBudget.swift" },
        { "symbol": "ReconnectPolicy", "path": "RealtimeTranslator/Realtime/ReconnectBudget.swift" },
        { "symbol": "ReconnectDecisionKind", "path": "RealtimeTranslator/Realtime/ReconnectBudget.swift" },
        { "symbol": "ReconnectDecision", "path": "RealtimeTranslator/Realtime/ReconnectBudget.swift" }
      ],
      "csharp": [
        { "symbol": "ReconnectBudget", "path": "windows/src/RealtimeTranslator.Core/Realtime/ReconnectBudget.cs" },
        { "symbol": "ReconnectPolicy", "path": "windows/src/RealtimeTranslator.Core/Realtime/ReconnectBudget.cs" },
        { "symbol": "ReconnectDecisionKind", "path": "windows/src/RealtimeTranslator.Core/Realtime/ReconnectBudget.cs" },
        { "symbol": "ReconnectDecision", "path": "windows/src/RealtimeTranslator.Core/Realtime/ReconnectBudget.cs" }
      ],
      "fixtures": ["v1/reconnect"]
    },
    {
      "name": "RoutingSourceTextWindow",
      "swift": { "symbol": "RoutingSourceTextWindow", "path": "RealtimeTranslator/Realtime/RoutingSourceTextWindow.swift" },
      "csharp": { "symbol": "RoutingSourceTextWindow", "path": "windows/src/RealtimeTranslator.Core/Realtime/RoutingSourceTextWindow.cs" },
      "fixtures": ["v1/routing"]
    },
    {
      "name": "SessionHealthBookkeeper",
      "swift": { "symbol": "SessionHealthBookkeeper", "path": "RealtimeTranslator/Realtime/SessionHealthBookkeeper.swift" },
      "csharp": { "symbol": "SessionHealthBookkeeper", "path": "windows/src/RealtimeTranslator.Core/Realtime/SessionHealthBookkeeper.cs" },
      "fixtures": ["v1/health"]
    },
    {
      "name": "SessionHealthMonitor",
      "swift": [
        { "symbol": "SessionHealthMonitor", "path": "RealtimeTranslator/Realtime/SessionHealthMonitor.swift" },
        { "symbol": "SessionHealthDetectionKind", "path": "RealtimeTranslator/Realtime/SessionHealthMonitor.swift" },
        { "symbol": "SessionHealthPhase", "path": "RealtimeTranslator/Realtime/SessionHealthMonitor.swift" },
        { "symbol": "SessionTerminationKind", "path": "RealtimeTranslator/Realtime/SessionHealthMonitor.swift" },
        { "symbol": "SessionHealthDetection", "path": "RealtimeTranslator/Realtime/SessionHealthMonitor.swift" },
        { "symbol": "SessionTerminationDiagnostic", "path": "RealtimeTranslator/Realtime/SessionHealthMonitor.swift" },
        { "symbol": "SessionHealthSnapshot", "path": "RealtimeTranslator/Realtime/SessionHealthMonitor.swift" },
        { "symbol": "SessionHealthThresholds", "path": "RealtimeTranslator/Realtime/SessionHealthMonitor.swift" }
      ],
      "csharp": [
        { "symbol": "SessionHealthMonitor", "path": "windows/src/RealtimeTranslator.Core/Realtime/SessionHealthMonitor.cs" },
        { "symbol": "SessionHealthDetectionKind", "path": "windows/src/RealtimeTranslator.Core/Realtime/SessionHealthMonitor.cs" },
        { "symbol": "SessionHealthPhase", "path": "windows/src/RealtimeTranslator.Core/Realtime/SessionHealthMonitor.cs" },
        { "symbol": "SessionTerminationKind", "path": "windows/src/RealtimeTranslator.Core/Realtime/SessionHealthMonitor.cs" },
        { "symbol": "SessionHealthDetection", "path": "windows/src/RealtimeTranslator.Core/Realtime/SessionHealthMonitor.cs" },
        { "symbol": "SessionTerminationDiagnostic", "path": "windows/src/RealtimeTranslator.Core/Realtime/SessionHealthMonitor.cs" },
        { "symbol": "SessionHealthSnapshot", "path": "windows/src/RealtimeTranslator.Core/Realtime/SessionHealthMonitor.cs" },
        { "symbol": "SessionHealthThresholds", "path": "windows/src/RealtimeTranslator.Core/Realtime/SessionHealthMonitor.cs" },
        { "symbol": "SessionTerminationKindMapping", "path": "windows/src/RealtimeTranslator.Core/Realtime/SessionHealthMonitor.cs" },
        { "symbol": "RealtimeTranslationLaneHealthExtensions", "path": "windows/src/RealtimeTranslator.Core/Realtime/SessionHealthMonitor.cs" }
      ],
      "fixtures": ["v1/health"]
    },
    {
      "name": "SessionSubtitlePipeline",
      "swift": { "symbol": "SessionSubtitlePipeline", "path": "RealtimeTranslator/Realtime/SessionSubtitlePipeline.swift" },
      "csharp": { "symbol": "SessionSubtitlePipeline", "path": "windows/src/RealtimeTranslator.Core/Realtime/SessionSubtitlePipeline.cs" },
      "fixtures": ["v2/subtitle"]
    },
    {
      "name": "SourceBoundaryTracker",
      "swift": [
        { "symbol": "SourceBoundaryTracker", "path": "RealtimeTranslator/Realtime/SourceBoundaryTracker.swift" },
        { "symbol": "OppositeScriptRun", "path": "RealtimeTranslator/Realtime/SourceBoundaryTracker.swift" }
      ],
      "csharp": [
        { "symbol": "SourceBoundaryTracker", "path": "windows/src/RealtimeTranslator.Core/Realtime/SourceBoundaryTracker.cs" },
        { "symbol": "OppositeScriptRun", "path": "windows/src/RealtimeTranslator.Core/Realtime/SourceBoundaryTracker.cs" }
      ],
      "fixtures": ["v2/subtitle"]
    },
    {
      "name": "TranslationTargetSelector",
      "swift": [
        { "symbol": "TranslationTargetSelector", "path": "RealtimeTranslator/Realtime/TranslationTargetSelector.swift" },
        { "symbol": "TranslationTargetSelection", "path": "RealtimeTranslator/Realtime/TranslationTargetSelector.swift" }
      ],
      "csharp": [
        { "symbol": "TranslationTargetSelector", "path": "windows/src/RealtimeTranslator.Core/Realtime/TranslationTargetSelector.cs" },
        { "symbol": "TranslationTargetSelection", "path": "windows/src/RealtimeTranslator.Core/Realtime/TranslationTargetSelector.cs" }
      ],
      "fixtures": ["v1/routing"]
    },
    {
      "name": "DualRealtimeTranslationClient",
      "swift": [
        { "symbol": "DualRealtimeTranslationClient", "path": "RealtimeTranslator/OpenAI/DualRealtimeTranslationClient.swift" },
        { "symbol": "DualRealtimeTranslationClienting", "path": "RealtimeTranslator/OpenAI/DualRealtimeTranslationClient.swift" }
      ],
      "csharp": [
        { "symbol": "DualRealtimeTranslationClient", "path": "windows/src/RealtimeTranslator.Core/Realtime/DualRealtimeTranslationClient.cs" },
        { "symbol": "IDualRealtimeTranslationClient", "path": "windows/src/RealtimeTranslator.Core/Realtime/DualRealtimeTranslationClient.cs" }
      ],
      "fixtures": ["v1/translation-queue"]
    },
    {
      "name": "DualRealtimeTranslationClientTuning",
      "swift": { "symbol": "DualRealtimeTranslationClientTuning", "path": "RealtimeTranslator/OpenAI/DualRealtimeTranslationClientTuning.swift" },
      "csharp": { "symbol": "DualRealtimeTranslationClientTuning", "path": "windows/src/RealtimeTranslator.Core/Realtime/DualRealtimeTranslationClientTuning.cs" }
    },
    {
      "name": "EventDelivery",
      "swift": [
        { "symbol": "EventDeliveryState", "path": "RealtimeTranslator/OpenAI/EventDeliveryState.swift" },
        { "symbol": "EventDeliveryStage", "path": "RealtimeTranslator/OpenAI/EventDeliveryState.swift" },
        { "symbol": "EventDeliveryTermination", "path": "RealtimeTranslator/OpenAI/EventDeliveryState.swift" },
        { "symbol": "EventDeliveryYielder", "path": "RealtimeTranslator/OpenAI/EventDeliveryState.swift" },
        { "symbol": "EventFeed", "path": "RealtimeTranslator/OpenAI/EventDeliveryState.swift" }
      ],
      "csharp": [
        { "symbol": "EventDeliveryState", "path": "windows/src/RealtimeTranslator.Core/Realtime/EventDelivery.cs" },
        { "symbol": "EventDeliveryStage", "path": "windows/src/RealtimeTranslator.Core/Realtime/EventDelivery.cs" },